{"identity":{"credential_event_digest":"sha256:ad07cc78a897ad959977e5a8d852a7f0855e6c9e360442b76434531cb1ae8ca8","identity_genesis_digest":"sha256:ad07cc78a897ad959977e5a8d852a7f0855e6c9e360442b76434531cb1ae8ca8","identity_state_digest":"sha256:f51e6809d8f52fd5f7914a405c740a140dfa72822d0f26b0b43efca510d455dc","orcid":"https://orcid.org/0000-0003-3001-7690"},"schema":"urn:skyseal:webauthn-bundle:v1","seal_payload":{"commitment_format":"skyseal-sha256-set-v1","created_at":"2026-09-15T16:37:41Z","identity_id":"https://orcid.org/0000-0003-3001-7690","identity_state_digest":"sha256:f51e6809d8f52fd5f7914a405c740a140dfa72822d0f26b0b43efca510d455dc","identity_version":1,"nonce":"G_U6mbWjeClqvQGy-wn9WoMODShXXlOrFwLAzkge190","private_ledger_commitment":"sha256:60d3c8244c3e3387ab0cedcb3bc1f09fefa2456210a752adf3236ffde564b730","schema":"urn:skyseal:seal-payload:v1","seal_id":"01a0a5ed-be05-7003-ad38-3beeca53d051","sky_witness":{"attribution":"Japan Meteorological Agency (JMA)","image_digest":"sha256:4fdfe228f9f6c6667909a5410ffa3e24de8fc17819f1b7b9b52cc41c72a0d583","media_type":"image/jpeg","observation_time":"2026-09-15T16:10:00Z","platform":"Himawari-8/9","product":"Full Disk Band 13 infrared","provider":"Japan Meteorological Agency (JMA)","retrieved_at":"2026-09-15T16:36:56Z","schema":"urn:skyseal:sky-witness:v1","source_url":"https://www.data.jma.go.jp/mscweb/data/himawari/img/fd_/fd__b13_1610.jpg"},"subject_digest":{"algorithm":"sha256","value":"46a473f82820e85eae4bedbb45c55cff488a719077faeaebadbb809f9f7d818d"}},"verification":{"allowed_origin":"https://proof.excyberlab.net","rp_id":"proof.excyberlab.net"},"webauthn":{"authenticator_data":"EdbWTYuPw9QtSzE8jiIhpUMlLFo5aci40eUtlheY1ssdAAAAAA","client_data_json":"eyJ0eXBlIjoid2ViYXV0aG4uZ2V0IiwiY2hhbGxlbmdlIjoiY0R1c1AwUGV6TUZ2Qld3U3N2Y05xeklULVVaVmpoak51NEduNF9mOGxPYyIsIm9yaWdpbiI6Imh0dHBzOi8vcHJvb2YuZXhjeWJlcmxhYi5uZXQiLCJjcm9zc09yaWdpbiI6ZmFsc2V9","signature":"MEYCIQDxoHftlUdkxPqaDQRmKJVvBYfv0I2srBviaWg_urbUJQIhAIkGsJ6qG4dvTLSLdOxV0CLyty6Au2qDfM4VXHpgTWeY"}}
