{"identity":{"credential_event_digest":"sha256:ad07cc78a897ad959977e5a8d852a7f0855e6c9e360442b76434531cb1ae8ca8","identity_genesis_digest":"sha256:ad07cc78a897ad959977e5a8d852a7f0855e6c9e360442b76434531cb1ae8ca8","identity_state_digest":"sha256:f51e6809d8f52fd5f7914a405c740a140dfa72822d0f26b0b43efca510d455dc","orcid":"https://orcid.org/0000-0003-3001-7690"},"schema":"urn:skyseal:webauthn-bundle:v1","seal_payload":{"commitment_format":"skyseal-sha256-set-v1","created_at":"2026-09-13T12:25:34Z","identity_id":"https://orcid.org/0000-0003-3001-7690","identity_state_digest":"sha256:f51e6809d8f52fd5f7914a405c740a140dfa72822d0f26b0b43efca510d455dc","identity_version":1,"nonce":"u9vgOvjR17LsHNY_fbGulc--IVOzOrBtA-qjuATChfY","private_ledger_commitment":"sha256:9ea60e4fff8ee528b80515ec07979aa38b43f82bf4d6dfdc991812698ba9dd45","schema":"urn:skyseal:seal-payload:v1","seal_id":"01a09a96-810a-77c8-9349-887c444e9e10","sky_witness":{"attribution":"Japan Meteorological Agency (JMA)","image_digest":"sha256:9477481675967d018af715badaf827e3bd2c1819b1d73fb674f9d0c883b0c11c","media_type":"image/jpeg","observation_time":"2026-09-13T11:20:00Z","platform":"Himawari-8/9","product":"Full Disk Band 13 infrared","provider":"Japan Meteorological Agency (JMA)","retrieved_at":"2026-09-13T11:45:35Z","schema":"urn:skyseal:sky-witness:v1","source_url":"https://www.data.jma.go.jp/mscweb/data/himawari/img/fd_/fd__b13_1120.jpg"},"subject_digest":{"algorithm":"sha256","value":"20a2922929df50ab7e59d472c995630ab13b6632f9a8211fb946142f5585859d"}},"verification":{"allowed_origin":"https://proof.excyberlab.net","rp_id":"proof.excyberlab.net"},"webauthn":{"authenticator_data":"EdbWTYuPw9QtSzE8jiIhpUMlLFo5aci40eUtlheY1ssdAAAAAA","client_data_json":"eyJ0eXBlIjoid2ViYXV0aG4uZ2V0IiwiY2hhbGxlbmdlIjoiSXQtNEF3YVNCc0dIcDFET25TSFlkZmVUbWlWQk5TQVFuTkpXUXlfdzBRWSIsIm9yaWdpbiI6Imh0dHBzOi8vcHJvb2YuZXhjeWJlcmxhYi5uZXQiLCJjcm9zc09yaWdpbiI6ZmFsc2V9","signature":"MEUCIBOUTlBlVFWLlwXVhcBonf9iO85zdvRwQBJ9ERHa0gX0AiEAm8t3n_b00ZYiO8sevB2fypDIICR4ShCuuUf_inAhxEI"}}
