{"identity":{"credential_event_digest":"sha256:ad07cc78a897ad959977e5a8d852a7f0855e6c9e360442b76434531cb1ae8ca8","identity_genesis_digest":"sha256:ad07cc78a897ad959977e5a8d852a7f0855e6c9e360442b76434531cb1ae8ca8","identity_state_digest":"sha256:f51e6809d8f52fd5f7914a405c740a140dfa72822d0f26b0b43efca510d455dc","orcid":"https://orcid.org/0000-0003-3001-7690"},"schema":"urn:skyseal:webauthn-bundle:v1","seal_payload":{"commitment_format":"skyseal-sha256-set-v1","created_at":"2026-09-18T02:01:47Z","identity_id":"https://orcid.org/0000-0003-3001-7690","identity_state_digest":"sha256:f51e6809d8f52fd5f7914a405c740a140dfa72822d0f26b0b43efca510d455dc","identity_version":1,"nonce":"GTeY9IXXfo1sM0Jmil0Z_Ie5mkH7KSzOM2Bu7Fzv0Ac","private_ledger_commitment":"sha256:9cddfc11878f733b659b1b00b5646732cb35ce8f639f737979980b8f48b9ca4d","schema":"urn:skyseal:seal-payload:v1","seal_id":"01a0b230-f357-7f6b-a379-c075049c32ea","sky_witness":{"attribution":"Japan Meteorological Agency (JMA)","image_digest":"sha256:571604b9f38fcb62c7e76fe47e8c4f8b1d9b902b35c5908d626fecdd170a1f2d","media_type":"image/jpeg","observation_time":"2026-09-18T01:20:00Z","platform":"Himawari-8/9","product":"Full Disk Band 13 infrared","provider":"Japan Meteorological Agency (JMA)","retrieved_at":"2026-09-18T01:45:47Z","schema":"urn:skyseal:sky-witness:v1","source_url":"https://www.data.jma.go.jp/mscweb/data/himawari/img/fd_/fd__b13_0120.jpg"},"subject_digest":{"algorithm":"sha256","value":"2af9a94fb0411649b134f2542ead2dcf916f2503c5ff36096dcfc16e606a0a3d"}},"verification":{"allowed_origin":"https://proof.excyberlab.net","rp_id":"proof.excyberlab.net"},"webauthn":{"authenticator_data":"EdbWTYuPw9QtSzE8jiIhpUMlLFo5aci40eUtlheY1ssdAAAAAA","client_data_json":"eyJ0eXBlIjoid2ViYXV0aG4uZ2V0IiwiY2hhbGxlbmdlIjoid0hhTW0tX0ZyeExRVV9HcERPQllFeG9taWdaX21RWU02N2N1d25IcFlKUSIsIm9yaWdpbiI6Imh0dHBzOi8vcHJvb2YuZXhjeWJlcmxhYi5uZXQiLCJjcm9zc09yaWdpbiI6ZmFsc2V9","signature":"MEYCIQDEvQYuj90qVj5s4CQ28hX4WbULDIzdQft4UqxuXh54jQIhAMP-gzgFW77PWrrPx6A9LndAWGltPDM1gKLgF9iqe9Ow"}}
