{"identity":{"credential_event_digest":"sha256:ad07cc78a897ad959977e5a8d852a7f0855e6c9e360442b76434531cb1ae8ca8","identity_genesis_digest":"sha256:ad07cc78a897ad959977e5a8d852a7f0855e6c9e360442b76434531cb1ae8ca8","identity_state_digest":"sha256:f51e6809d8f52fd5f7914a405c740a140dfa72822d0f26b0b43efca510d455dc","orcid":"https://orcid.org/0000-0003-3001-7690"},"schema":"urn:skyseal:webauthn-bundle:v1","seal_payload":{"commitment_format":"skyseal-sha256-set-v1","created_at":"2026-09-27T02:22:49Z","identity_id":"https://orcid.org/0000-0003-3001-7690","identity_state_digest":"sha256:f51e6809d8f52fd5f7914a405c740a140dfa72822d0f26b0b43efca510d455dc","identity_version":1,"nonce":"3gK_nxsBJXiLgKDQ7UBoyxMHx4GcyGe-CmwlpuXoUls","private_ledger_commitment":"sha256:3258f9c9a78d57cdbb8568f8c3df17096fd19b507c65f6225bfd2fe629683cf6","schema":"urn:skyseal:seal-payload:v1","seal_id":"01a0e06d-7c46-79e7-b39d-a055a1a1553d","sky_witness":{"attribution":"Japan Meteorological Agency (JMA)","image_digest":"sha256:53ed65f1a4f5cec266c0e5130ef1150b6de46c9391a123a2b2b920405b0e457c","media_type":"image/jpeg","observation_time":"2026-09-27T00:50:00Z","platform":"Himawari-8/9","product":"Full Disk Band 13 infrared","provider":"Japan Meteorological Agency (JMA)","retrieved_at":"2026-09-27T01:14:24Z","schema":"urn:skyseal:sky-witness:v1","source_url":"https://www.data.jma.go.jp/mscweb/data/himawari/img/fd_/fd__b13_0050.jpg"},"subject_digest":{"algorithm":"sha256","value":"3bf68e8925cb6539f1c9a4c773682384f6530b7ec9957e622502b370f91df1d1"}},"verification":{"allowed_origin":"https://proof.excyberlab.net","rp_id":"proof.excyberlab.net"},"webauthn":{"authenticator_data":"EdbWTYuPw9QtSzE8jiIhpUMlLFo5aci40eUtlheY1ssdAAAAAA","client_data_json":"eyJ0eXBlIjoid2ViYXV0aG4uZ2V0IiwiY2hhbGxlbmdlIjoibHlJRktSRk5vR1pHZ1ZUcGo3Sm04Yk1mLTFWUFY0TDBmTi1MeU00SDU3cyIsIm9yaWdpbiI6Imh0dHBzOi8vcHJvb2YuZXhjeWJlcmxhYi5uZXQiLCJjcm9zc09yaWdpbiI6ZmFsc2V9","signature":"MEQCIFosYxdNDkaNf5IpzFYbHpDYxkVQ1uHW6pVlYSwGeBP3AiAPU8Dl8F3MPfmRbaunV0DQ-hlVrmRXCIL7tOjqcmkB3A"}}
