{"identity":{"credential_event_digest":"sha256:ad07cc78a897ad959977e5a8d852a7f0855e6c9e360442b76434531cb1ae8ca8","identity_genesis_digest":"sha256:ad07cc78a897ad959977e5a8d852a7f0855e6c9e360442b76434531cb1ae8ca8","identity_state_digest":"sha256:f51e6809d8f52fd5f7914a405c740a140dfa72822d0f26b0b43efca510d455dc","orcid":"https://orcid.org/0000-0003-3001-7690"},"schema":"urn:skyseal:webauthn-bundle:v1","seal_payload":{"commitment_format":"skyseal-sha256-set-v1","created_at":"2026-09-25T14:06:28Z","identity_id":"https://orcid.org/0000-0003-3001-7690","identity_state_digest":"sha256:f51e6809d8f52fd5f7914a405c740a140dfa72822d0f26b0b43efca510d455dc","identity_version":1,"nonce":"Ao56eCCX4YXnJ3iWTvr-FlLwSGdKN284c9KZ-I__Xl0","private_ledger_commitment":"sha256:1f496292f7e4fd67557fbb576423b5e2ec0e8ea029ba4eb174d0997282dec1f1","schema":"urn:skyseal:seal-payload:v1","seal_id":"01a0d8e1-2710-7a8b-b7f4-098d916f5771","sky_witness":{"attribution":"Japan Meteorological Agency (JMA)","image_digest":"sha256:f396ce6d156b48bb9cfdfc459f034186c1d5ee1a4803277d08f277ba61038e2e","media_type":"image/jpeg","observation_time":"2026-09-25T13:40:00Z","platform":"Himawari-8/9","product":"Full Disk Band 13 infrared","provider":"Japan Meteorological Agency (JMA)","retrieved_at":"2026-09-25T14:03:46Z","schema":"urn:skyseal:sky-witness:v1","source_url":"https://www.data.jma.go.jp/mscweb/data/himawari/img/fd_/fd__b13_1340.jpg"},"subject_digest":{"algorithm":"sha256","value":"8781019d0991bfcafbaa0cbfb32cb4492e919b370feabf0531dd99644fb576f6"}},"verification":{"allowed_origin":"https://proof.excyberlab.net","rp_id":"proof.excyberlab.net"},"webauthn":{"authenticator_data":"EdbWTYuPw9QtSzE8jiIhpUMlLFo5aci40eUtlheY1ssdAAAAAA","client_data_json":"eyJ0eXBlIjoid2ViYXV0aG4uZ2V0IiwiY2hhbGxlbmdlIjoiRkhJQlh2RlpIYTFwSTZxRmRGamlEMHlWNldHUGYzR0tsWnNoWVFLTnFYSSIsIm9yaWdpbiI6Imh0dHBzOi8vcHJvb2YuZXhjeWJlcmxhYi5uZXQiLCJjcm9zc09yaWdpbiI6ZmFsc2V9","signature":"MEQCIBu4B1F0ZDfKmXaICOUUWE-Du0vgILvjffUiWFwu263AAiBVd9BXA3ujDzcCIvV5ol9ZoxKKxt2C-laZKzcMLwbWXw"}}
