{"identity":{"credential_event_digest":"sha256:ad07cc78a897ad959977e5a8d852a7f0855e6c9e360442b76434531cb1ae8ca8","identity_genesis_digest":"sha256:ad07cc78a897ad959977e5a8d852a7f0855e6c9e360442b76434531cb1ae8ca8","identity_state_digest":"sha256:f51e6809d8f52fd5f7914a405c740a140dfa72822d0f26b0b43efca510d455dc","orcid":"https://orcid.org/0000-0003-3001-7690"},"schema":"urn:skyseal:webauthn-bundle:v1","seal_payload":{"commitment_format":"skyseal-sha256-set-v1","created_at":"2026-09-09T01:01:45Z","identity_id":"https://orcid.org/0000-0003-3001-7690","identity_state_digest":"sha256:f51e6809d8f52fd5f7914a405c740a140dfa72822d0f26b0b43efca510d455dc","identity_version":1,"nonce":"eZZ_Dd2WRqFg7ubTZtbdGUBt9Xf6F9XHWccurUeDCUU","private_ledger_commitment":"sha256:96420e1c794eedc69a4ab78fb77ca466d922082037059c7c70e4d4fb129379c0","schema":"urn:skyseal:seal-payload:v1","seal_id":"01a083a9-3b58-7ace-9087-4ba461ebefb1","sky_witness":{"attribution":"Japan Meteorological Agency (JMA)","image_digest":"sha256:c2221f5e488d2d4c883a9fe30a72b86cd4eef6121de8be39e3df154027da6284","media_type":"image/jpeg","observation_time":"2026-09-09T00:30:00Z","platform":"Himawari-8/9","product":"Full Disk Band 13 infrared","provider":"Japan Meteorological Agency (JMA)","retrieved_at":"2026-09-09T00:54:56Z","schema":"urn:skyseal:sky-witness:v1","source_url":"https://www.data.jma.go.jp/mscweb/data/himawari/img/fd_/fd__b13_0030.jpg"},"subject_digest":{"algorithm":"sha256","value":"67bdebebf1f12ddf87b3f63f8dfe21976720e1aaecf89abd5199150581804c92"}},"verification":{"allowed_origin":"https://proof.excyberlab.net","rp_id":"proof.excyberlab.net"},"webauthn":{"authenticator_data":"EdbWTYuPw9QtSzE8jiIhpUMlLFo5aci40eUtlheY1ssdAAAAAA","client_data_json":"eyJ0eXBlIjoid2ViYXV0aG4uZ2V0IiwiY2hhbGxlbmdlIjoiZWNONXdEWFdiZTJ5V1JOS3BVX2puWHdha1pPMWtzVEpWdU9WMlNrMGVIcyIsIm9yaWdpbiI6Imh0dHBzOi8vcHJvb2YuZXhjeWJlcmxhYi5uZXQiLCJjcm9zc09yaWdpbiI6ZmFsc2V9","signature":"MEUCIQDbydWGXaRvYbKunatcHBbQg8pCAK69mVGLbUFa9AZUngIgAUuJS-poVVqRxKxXP3NHDL7ELjZjNEoeQWO4VxE1mCU"}}
