{"identity":{"credential_event_digest":"sha256:ad07cc78a897ad959977e5a8d852a7f0855e6c9e360442b76434531cb1ae8ca8","identity_genesis_digest":"sha256:ad07cc78a897ad959977e5a8d852a7f0855e6c9e360442b76434531cb1ae8ca8","identity_state_digest":"sha256:f51e6809d8f52fd5f7914a405c740a140dfa72822d0f26b0b43efca510d455dc","orcid":"https://orcid.org/0000-0003-3001-7690"},"schema":"urn:skyseal:webauthn-bundle:v1","seal_payload":{"commitment_format":"skyseal-sha256-set-v1","created_at":"2026-09-27T08:08:48Z","identity_id":"https://orcid.org/0000-0003-3001-7690","identity_state_digest":"sha256:f51e6809d8f52fd5f7914a405c740a140dfa72822d0f26b0b43efca510d455dc","identity_version":1,"nonce":"1by9wX-9HSII2Uw2IzlE0ebGTPisSVrIDKQTLTRVZnQ","private_ledger_commitment":"sha256:ada92c3019323a504e5ee39cfa2989f41cf913c866820a834ec2a017196e48cd","schema":"urn:skyseal:seal-payload:v1","seal_id":"01a0e1e8-18da-7828-b776-92a8c07b7f15","sky_witness":{"attribution":"Japan Meteorological Agency (JMA)","image_digest":"sha256:426c2491fc5a90b4ee6e6248b803a5d5206e0e52cc491dccf6842b5e74a84d30","media_type":"image/jpeg","observation_time":"2026-09-27T07:40:00Z","platform":"Himawari-8/9","product":"Full Disk Band 13 infrared","provider":"Japan Meteorological Agency (JMA)","retrieved_at":"2026-09-27T08:07:59Z","schema":"urn:skyseal:sky-witness:v1","source_url":"https://www.data.jma.go.jp/mscweb/data/himawari/img/fd_/fd__b13_0740.jpg"},"subject_digest":{"algorithm":"sha256","value":"a9cbdc9af80c8eabc21dac8e7e47ff400f8903987b2f87f9591719139b6f07fe"}},"verification":{"allowed_origin":"https://proof.excyberlab.net","rp_id":"proof.excyberlab.net"},"webauthn":{"authenticator_data":"EdbWTYuPw9QtSzE8jiIhpUMlLFo5aci40eUtlheY1ssdAAAAAA","client_data_json":"eyJ0eXBlIjoid2ViYXV0aG4uZ2V0IiwiY2hhbGxlbmdlIjoiMVN5TVRrdjdZYlhOc1JuMzVjck1NQk1WN3pxcTk4Y2hYLXA1Q0dOT2RWQSIsIm9yaWdpbiI6Imh0dHBzOi8vcHJvb2YuZXhjeWJlcmxhYi5uZXQiLCJjcm9zc09yaWdpbiI6ZmFsc2V9","signature":"MEYCIQCJHEBWdXg1X5sz0Sw14GPkYTAAHCoXp-q2_OG1jagyIQIhAJlsSiu_85IniAOAdtYb-aUFK2ak8foKR7EZ0hPMyuRV"}}
