{"identity":{"credential_event_digest":"sha256:ad07cc78a897ad959977e5a8d852a7f0855e6c9e360442b76434531cb1ae8ca8","identity_genesis_digest":"sha256:ad07cc78a897ad959977e5a8d852a7f0855e6c9e360442b76434531cb1ae8ca8","identity_state_digest":"sha256:f51e6809d8f52fd5f7914a405c740a140dfa72822d0f26b0b43efca510d455dc","orcid":"https://orcid.org/0000-0003-3001-7690"},"schema":"urn:skyseal:webauthn-bundle:v1","seal_payload":{"commitment_format":"skyseal-sha256-set-v1","created_at":"2026-09-11T12:23:27Z","identity_id":"https://orcid.org/0000-0003-3001-7690","identity_state_digest":"sha256:f51e6809d8f52fd5f7914a405c740a140dfa72822d0f26b0b43efca510d455dc","identity_version":1,"nonce":"t7D53RZ6o5YZdbafh89MDpGKqcanmp8_YhRR5j5co4w","private_ledger_commitment":"sha256:4c925923e58aad1b749f5b05a3f7bb43bb6f44695f9f13b604b8e157985436cc","schema":"urn:skyseal:seal-payload:v1","seal_id":"01a09048-f689-7856-95b2-fa08a3872e2f","sky_witness":{"attribution":"Japan Meteorological Agency (JMA)","image_digest":"sha256:1b085dda4e4fa9744666e2dfa787a26c674b1742a33e71e44b2928eef043a890","media_type":"image/jpeg","observation_time":"2026-09-11T11:20:00Z","platform":"Himawari-8/9","product":"Full Disk Band 13 infrared","provider":"Japan Meteorological Agency (JMA)","retrieved_at":"2026-09-11T11:44:55Z","schema":"urn:skyseal:sky-witness:v1","source_url":"https://www.data.jma.go.jp/mscweb/data/himawari/img/fd_/fd__b13_1120.jpg"},"subject_digest":{"algorithm":"sha256","value":"b2165b1f7771000331a93687a1eaa9e7a1b68016fac8c683870098f5e34511b6"}},"verification":{"allowed_origin":"https://proof.excyberlab.net","rp_id":"proof.excyberlab.net"},"webauthn":{"authenticator_data":"EdbWTYuPw9QtSzE8jiIhpUMlLFo5aci40eUtlheY1ssdAAAAAA","client_data_json":"eyJ0eXBlIjoid2ViYXV0aG4uZ2V0IiwiY2hhbGxlbmdlIjoiS3NhMmlrLXdTNm9hNTIyVzRwZVlESE5oQjV6cEEtTzdzTnc4RU9kT08wWSIsIm9yaWdpbiI6Imh0dHBzOi8vcHJvb2YuZXhjeWJlcmxhYi5uZXQiLCJjcm9zc09yaWdpbiI6ZmFsc2V9","signature":"MEUCIDMIFgwKGG5-b4IfJEiujOrNFLGQ4PIhLIQ-sG-cDS7IAiEAtBUSy62_XgT9CEmyZUPyyzoM_FXAhh9xjBrcYldDwq8"}}
