{"identity":{"credential_event_digest":"sha256:ad07cc78a897ad959977e5a8d852a7f0855e6c9e360442b76434531cb1ae8ca8","identity_genesis_digest":"sha256:ad07cc78a897ad959977e5a8d852a7f0855e6c9e360442b76434531cb1ae8ca8","identity_state_digest":"sha256:f51e6809d8f52fd5f7914a405c740a140dfa72822d0f26b0b43efca510d455dc","orcid":"https://orcid.org/0000-0003-3001-7690"},"schema":"urn:skyseal:webauthn-bundle:v1","seal_payload":{"commitment_format":"skyseal-sha256-set-v1","created_at":"2026-09-15T09:38:06Z","identity_id":"https://orcid.org/0000-0003-3001-7690","identity_state_digest":"sha256:f51e6809d8f52fd5f7914a405c740a140dfa72822d0f26b0b43efca510d455dc","identity_version":1,"nonce":"w0yoAJf-ImZRp3oeK2arm4QxeaYKeHJnKD9YdP0XGeU","private_ledger_commitment":"sha256:7d1f7516878159e07a038a71bf63e06d6e1c3786a2c9191ed4d769dfa14b812a","schema":"urn:skyseal:seal-payload:v1","seal_id":"01a0a45d-d2d6-76d1-af3e-2f28eebc96e8","sky_witness":{"attribution":"Japan Meteorological Agency (JMA)","image_digest":"sha256:277caf8a2578d59deabd49089d5f70237e2ac5b704339e3463cde4eaec04344d","media_type":"image/jpeg","observation_time":"2026-09-15T09:00:00Z","platform":"Himawari-8/9","product":"Full Disk Band 13 infrared","provider":"Japan Meteorological Agency (JMA)","retrieved_at":"2026-09-15T09:20:05Z","schema":"urn:skyseal:sky-witness:v1","source_url":"https://www.data.jma.go.jp/mscweb/data/himawari/img/fd_/fd__b13_0900.jpg"},"subject_digest":{"algorithm":"sha256","value":"d62d4319a7af6add1f0ac83066f255ca49972731c3412959ca31dcf3c5743f28"}},"verification":{"allowed_origin":"https://proof.excyberlab.net","rp_id":"proof.excyberlab.net"},"webauthn":{"authenticator_data":"EdbWTYuPw9QtSzE8jiIhpUMlLFo5aci40eUtlheY1ssdAAAAAA","client_data_json":"eyJ0eXBlIjoid2ViYXV0aG4uZ2V0IiwiY2hhbGxlbmdlIjoib3pNTjYxQTM4MUFxOFhuQjZnaWU5NjVIZm5CWHdiZUJTdktDajNGeDF2YyIsIm9yaWdpbiI6Imh0dHBzOi8vcHJvb2YuZXhjeWJlcmxhYi5uZXQiLCJjcm9zc09yaWdpbiI6ZmFsc2V9","signature":"MEUCIQDfrK7k8d_RO0XTqNIwv0zHQwpEYf9BzLSG4bQbl2lFdQIgMFrb_ZfJoffJfd4enqaue0J_004XmdIqTdgnnD_Sds0"}}
