{"identity":{"credential_event_digest":"sha256:ad07cc78a897ad959977e5a8d852a7f0855e6c9e360442b76434531cb1ae8ca8","identity_genesis_digest":"sha256:ad07cc78a897ad959977e5a8d852a7f0855e6c9e360442b76434531cb1ae8ca8","identity_state_digest":"sha256:f51e6809d8f52fd5f7914a405c740a140dfa72822d0f26b0b43efca510d455dc","orcid":"https://orcid.org/0000-0003-3001-7690"},"schema":"urn:skyseal:webauthn-bundle:v1","seal_payload":{"commitment_format":"skyseal-sha256-set-v1","created_at":"2026-09-21T05:30:39Z","identity_id":"https://orcid.org/0000-0003-3001-7690","identity_state_digest":"sha256:f51e6809d8f52fd5f7914a405c740a140dfa72822d0f26b0b43efca510d455dc","identity_version":1,"nonce":"aZK40KW5c8S2sbZina1nVUVp69YYLOhjgBhkVcmdB5g","private_ledger_commitment":"sha256:6eae9432cd175daf548cdbd9da7e616921290498d6366c781e0884d5241876fe","schema":"urn:skyseal:seal-payload:v1","seal_id":"01a0c270-f27e-701c-974e-b8c648cce834","sky_witness":{"attribution":"Japan Meteorological Agency (JMA)","image_digest":"sha256:464b8d594380041e659e478551112f0b70963fc3084e1e6e1a63cd4f94e0d823","media_type":"image/jpeg","observation_time":"2026-09-21T05:00:00Z","platform":"Himawari-8/9","product":"Full Disk Band 13 infrared","provider":"Japan Meteorological Agency (JMA)","retrieved_at":"2026-09-21T05:29:35Z","schema":"urn:skyseal:sky-witness:v1","source_url":"https://www.data.jma.go.jp/mscweb/data/himawari/img/fd_/fd__b13_0500.jpg"},"subject_digest":{"algorithm":"sha256","value":"a71a7d096c2adb4d44dbd8df03446a2f1a911c8e9dbadcab3cdcdd2b26779c7b"}},"verification":{"allowed_origin":"https://proof.excyberlab.net","rp_id":"proof.excyberlab.net"},"webauthn":{"authenticator_data":"EdbWTYuPw9QtSzE8jiIhpUMlLFo5aci40eUtlheY1ssdAAAAAA","client_data_json":"eyJ0eXBlIjoid2ViYXV0aG4uZ2V0IiwiY2hhbGxlbmdlIjoiOHJSNEl3UzJfdXlTRjMyYVNrNEIxRGVtRDJoRzA4ekt0eVZKbmxSWEpEOCIsIm9yaWdpbiI6Imh0dHBzOi8vcHJvb2YuZXhjeWJlcmxhYi5uZXQiLCJjcm9zc09yaWdpbiI6ZmFsc2V9","signature":"MEYCIQCW7vq7KFqRF_y4gvL8dN_1V0QH6Ag-ktMMwuEA0FRggQIhANPNhlGEBr6zY7trr9b8Txl1z-xqAS6X9vtO_-YaztJN"}}
