{"identity":{"credential_event_digest":"sha256:ad07cc78a897ad959977e5a8d852a7f0855e6c9e360442b76434531cb1ae8ca8","identity_genesis_digest":"sha256:ad07cc78a897ad959977e5a8d852a7f0855e6c9e360442b76434531cb1ae8ca8","identity_state_digest":"sha256:f51e6809d8f52fd5f7914a405c740a140dfa72822d0f26b0b43efca510d455dc","orcid":"https://orcid.org/0000-0003-3001-7690"},"schema":"urn:skyseal:webauthn-bundle:v1","seal_payload":{"commitment_format":"skyseal-sha256-set-v1","created_at":"2026-08-30T08:11:35Z","identity_id":"https://orcid.org/0000-0003-3001-7690","identity_state_digest":"sha256:f51e6809d8f52fd5f7914a405c740a140dfa72822d0f26b0b43efca510d455dc","identity_version":1,"nonce":"73UvsrLhZ0hZN4PR1lJm4cpyYus5IbjEul-3mifNwLE","private_ledger_commitment":"sha256:6798171f347371819afcd17210fc7850304d88b062e5df357f4688abe4d0b247","schema":"urn:skyseal:seal-payload:v1","seal_id":"01a051b7-e0f5-71a2-b0b3-c8d25f4cfaaf","sky_witness":{"attribution":"Japan Meteorological Agency (JMA)","image_digest":"sha256:1d612dcb7ed3dc8b6d8c3e6bd8ab43817968270f1e6813601be8538ecb0e9b60","media_type":"image/jpeg","observation_time":"2026-08-30T07:40:00Z","platform":"Himawari-8/9","product":"Full Disk Band 13 infrared","provider":"Japan Meteorological Agency (JMA)","retrieved_at":"2026-08-30T08:09:53Z","schema":"urn:skyseal:sky-witness:v1","source_url":"https://www.data.jma.go.jp/mscweb/data/himawari/img/fd_/fd__b13_0740.jpg"},"subject_digest":{"algorithm":"sha256","value":"3e078018c12c23800b438b371af74b0204b7121be39db191daf4161f04a7a724"}},"verification":{"allowed_origin":"https://proof.excyberlab.net","rp_id":"proof.excyberlab.net"},"webauthn":{"authenticator_data":"EdbWTYuPw9QtSzE8jiIhpUMlLFo5aci40eUtlheY1ssdAAAAAA","client_data_json":"eyJ0eXBlIjoid2ViYXV0aG4uZ2V0IiwiY2hhbGxlbmdlIjoiR1AyMEV3QUNTanM2TUE2MVotandzRU1RYWNqMlpXNll5aWY2aHpObldsUSIsIm9yaWdpbiI6Imh0dHBzOi8vcHJvb2YuZXhjeWJlcmxhYi5uZXQiLCJjcm9zc09yaWdpbiI6ZmFsc2V9","signature":"MEUCIQDetZjHylDQfnR-Z1iXj2E0_tjOFSBwCDn3qK3hUEg3OwIgOTASV1-1l0yIReA3Eg0TUPwbuVB1HVnaRS4qvPH-uqY"}}
