{"identity":{"credential_event_digest":"sha256:ad07cc78a897ad959977e5a8d852a7f0855e6c9e360442b76434531cb1ae8ca8","identity_genesis_digest":"sha256:ad07cc78a897ad959977e5a8d852a7f0855e6c9e360442b76434531cb1ae8ca8","identity_state_digest":"sha256:f51e6809d8f52fd5f7914a405c740a140dfa72822d0f26b0b43efca510d455dc","orcid":"https://orcid.org/0000-0003-3001-7690"},"schema":"urn:skyseal:webauthn-bundle:v1","seal_payload":{"commitment_format":"skyseal-sha256-set-v1","created_at":"2026-09-24T13:12:09Z","identity_id":"https://orcid.org/0000-0003-3001-7690","identity_state_digest":"sha256:f51e6809d8f52fd5f7914a405c740a140dfa72822d0f26b0b43efca510d455dc","identity_version":1,"nonce":"sJaOiNpvyJX1QxkMLdmqbMWYTxCJ9Hnm5QwZJ6yJ2qs","private_ledger_commitment":"sha256:35a4bf7e2c9932f30dbdf34a9f7467995c5ca82c6e69d8a4f064112b72f4b4e4","schema":"urn:skyseal:seal-payload:v1","seal_id":"01a0d1f2-3013-7c89-b7d7-742f1c706453","sky_witness":{"attribution":"Japan Meteorological Agency (JMA)","image_digest":"sha256:1bc6b7ce1d2fbd8fc8bd08bd4d09c5f7f0f98b869155f69184278bf795c4dcc6","media_type":"image/jpeg","observation_time":"2026-09-24T05:20:00Z","platform":"Himawari-8/9","product":"Full Disk Band 13 infrared","provider":"Japan Meteorological Agency (JMA)","retrieved_at":"2026-09-24T05:45:05Z","schema":"urn:skyseal:sky-witness:v1","source_url":"https://www.data.jma.go.jp/mscweb/data/himawari/img/fd_/fd__b13_0520.jpg"},"subject_digest":{"algorithm":"sha256","value":"66f8f09599e779e3345f9afe6730a3ba66f4263a2a222d3692534c8dba054afb"}},"verification":{"allowed_origin":"https://proof.excyberlab.net","rp_id":"proof.excyberlab.net"},"webauthn":{"authenticator_data":"EdbWTYuPw9QtSzE8jiIhpUMlLFo5aci40eUtlheY1ssdAAAAAA","client_data_json":"eyJ0eXBlIjoid2ViYXV0aG4uZ2V0IiwiY2hhbGxlbmdlIjoidGtVT1dWbHBwY2tVT2FLWGFteU1pSjVoWnY3a1dtX3V3WkdIM2xyQXlpVSIsIm9yaWdpbiI6Imh0dHBzOi8vcHJvb2YuZXhjeWJlcmxhYi5uZXQiLCJjcm9zc09yaWdpbiI6ZmFsc2V9","signature":"MEYCIQCKMwMvCQ4MSWuRrx7b5qXKL1LPnoUUxk3XvhjRFCao2gIhALRCO0Ei7MbVBn5CfnGb2_H0n5IZo9UVuQYTJ3RzuqMV"}}
