{"identity":{"credential_event_digest":"sha256:ad07cc78a897ad959977e5a8d852a7f0855e6c9e360442b76434531cb1ae8ca8","identity_genesis_digest":"sha256:ad07cc78a897ad959977e5a8d852a7f0855e6c9e360442b76434531cb1ae8ca8","identity_state_digest":"sha256:f51e6809d8f52fd5f7914a405c740a140dfa72822d0f26b0b43efca510d455dc","orcid":"https://orcid.org/0000-0003-3001-7690"},"schema":"urn:skyseal:webauthn-bundle:v1","seal_payload":{"commitment_format":"skyseal-sha256-set-v1","created_at":"2026-09-20T01:14:09Z","identity_id":"https://orcid.org/0000-0003-3001-7690","identity_state_digest":"sha256:f51e6809d8f52fd5f7914a405c740a140dfa72822d0f26b0b43efca510d455dc","identity_version":1,"nonce":"6ZW_Q7F859Q2t8ZNk8Yvrt_NHAldAWCBRC7uFGcz9fw","private_ledger_commitment":"sha256:72b3f579b8e8e472b4179f2cd4bd14d833ebf20cb9b4130cebce23aec5fc977b","schema":"urn:skyseal:seal-payload:v1","seal_id":"01a0bc55-dd34-7d64-a79d-7994107904af","sky_witness":{"attribution":"Japan Meteorological Agency (JMA)","image_digest":"sha256:71d143cd0be1242925c5b528a39c027024d60f883850648b51a48cd4fa8bbbf8","media_type":"image/jpeg","observation_time":"2026-09-20T00:30:00Z","platform":"Himawari-8/9","product":"Full Disk Band 13 infrared","provider":"Japan Meteorological Agency (JMA)","retrieved_at":"2026-09-20T01:02:06Z","schema":"urn:skyseal:sky-witness:v1","source_url":"https://www.data.jma.go.jp/mscweb/data/himawari/img/fd_/fd__b13_0030.jpg"},"subject_digest":{"algorithm":"sha256","value":"5af2ed2d41a73647ff44c20966ebfe3ba5f9454c19775c84689b832c0722ef91"}},"verification":{"allowed_origin":"https://proof.excyberlab.net","rp_id":"proof.excyberlab.net"},"webauthn":{"authenticator_data":"EdbWTYuPw9QtSzE8jiIhpUMlLFo5aci40eUtlheY1ssdAAAAAA","client_data_json":"eyJ0eXBlIjoid2ViYXV0aG4uZ2V0IiwiY2hhbGxlbmdlIjoidHhtR1FSRHl0eDRuUXlVUk5xV3JDMGRIYVo1aHNJTDlYeE4xQk5yU3FvMCIsIm9yaWdpbiI6Imh0dHBzOi8vcHJvb2YuZXhjeWJlcmxhYi5uZXQiLCJjcm9zc09yaWdpbiI6ZmFsc2V9","signature":"MEQCIH9wuY1TRuQ2bAAeYd1qDyQc2nRsdwVG5yHXPnVQ1bgkAiASvqDn0LfL_rKwew3rEj01YC7Vl5Lf221P1GWzcLU9EQ"}}
