{"identity":{"credential_event_digest":"sha256:ad07cc78a897ad959977e5a8d852a7f0855e6c9e360442b76434531cb1ae8ca8","identity_genesis_digest":"sha256:ad07cc78a897ad959977e5a8d852a7f0855e6c9e360442b76434531cb1ae8ca8","identity_state_digest":"sha256:f51e6809d8f52fd5f7914a405c740a140dfa72822d0f26b0b43efca510d455dc","orcid":"https://orcid.org/0000-0003-3001-7690"},"schema":"urn:skyseal:webauthn-bundle:v1","seal_payload":{"commitment_format":"skyseal-sha256-set-v1","created_at":"2026-10-17T10:25:05Z","identity_id":"https://orcid.org/0000-0003-3001-7690","identity_state_digest":"sha256:f51e6809d8f52fd5f7914a405c740a140dfa72822d0f26b0b43efca510d455dc","identity_version":1,"nonce":"o-v95JdhY53_OF7qpwtDqE-dC6tGI5yg6kqkiIbZ0Bw","private_ledger_commitment":"sha256:9200f65903b27b37974dced45f460230d22cadd833e26384fcb6bc72f6e5d5fd","schema":"urn:skyseal:seal-payload:v1","seal_id":"01a14946-0663-70ad-b69f-f2ea9cdf2c58","sky_witness":{"attribution":"Japan Meteorological Agency (JMA)","image_digest":"sha256:ac86992ed4d8c03871b6be6760990eceb8d03b39fb0454c6dfc8e1307b6d37bc","media_type":"image/jpeg","observation_time":"2026-10-17T09:30:00Z","platform":"Himawari-8/9","product":"Full Disk Band 13 infrared","provider":"Japan Meteorological Agency (JMA)","retrieved_at":"2026-10-17T09:51:28Z","schema":"urn:skyseal:sky-witness:v1","source_url":"https://www.data.jma.go.jp/mscweb/data/himawari/img/fd_/fd__b13_0930.jpg"},"subject_digest":{"algorithm":"sha256","value":"19d6fd9640b08e385f14968dc59fc63a4f19f41d0b4869d735e79aafa244a06e"}},"verification":{"allowed_origin":"https://proof.excyberlab.net","rp_id":"proof.excyberlab.net"},"webauthn":{"authenticator_data":"EdbWTYuPw9QtSzE8jiIhpUMlLFo5aci40eUtlheY1ssdAAAAAA","client_data_json":"eyJ0eXBlIjoid2ViYXV0aG4uZ2V0IiwiY2hhbGxlbmdlIjoiSXBTZm5YWDFCV09nLVlfeWVZWGU3UV9nWURIUl9aSVQyVVg1SU9nSmhjcyIsIm9yaWdpbiI6Imh0dHBzOi8vcHJvb2YuZXhjeWJlcmxhYi5uZXQiLCJjcm9zc09yaWdpbiI6ZmFsc2V9","signature":"MEYCIQCa5PujXw1Dj7I0EBfD3I_0bL8TdjHmfTKJ9EmOUSLZTgIhAKxHmfeSpxEZqPQY3hWdePz7j5JqGWCl5OhRNdoDvVZR"}}
