{"identity":{"credential_event_digest":"sha256:ad07cc78a897ad959977e5a8d852a7f0855e6c9e360442b76434531cb1ae8ca8","identity_genesis_digest":"sha256:ad07cc78a897ad959977e5a8d852a7f0855e6c9e360442b76434531cb1ae8ca8","identity_state_digest":"sha256:f51e6809d8f52fd5f7914a405c740a140dfa72822d0f26b0b43efca510d455dc","orcid":"https://orcid.org/0000-0003-3001-7690"},"schema":"urn:skyseal:webauthn-bundle:v1","seal_payload":{"commitment_format":"skyseal-sha256-set-v1","created_at":"2026-09-26T14:15:01Z","identity_id":"https://orcid.org/0000-0003-3001-7690","identity_state_digest":"sha256:f51e6809d8f52fd5f7914a405c740a140dfa72822d0f26b0b43efca510d455dc","identity_version":1,"nonce":"PHbRgHxHtw4WMQyUA4C5ec_NWJ9HaNN0xT59SkQFutE","private_ledger_commitment":"sha256:095f0f8ab8e4dedcdd7904d5def38aba4eda0196b53ab8a2cf7b44cefcfbc2ea","schema":"urn:skyseal:seal-payload:v1","seal_id":"01a0de00-1c5f-7ec9-8d82-58b6a4d2b424","sky_witness":{"attribution":"Japan Meteorological Agency (JMA)","image_digest":"sha256:65013b1ef77f5db232cf0558d4325e708cf3425e7cc207184d4ccb11cee3eefc","media_type":"image/jpeg","observation_time":"2026-09-26T13:30:00Z","platform":"Himawari-8/9","product":"Full Disk Band 13 infrared","provider":"Japan Meteorological Agency (JMA)","retrieved_at":"2026-09-26T13:55:43Z","schema":"urn:skyseal:sky-witness:v1","source_url":"https://www.data.jma.go.jp/mscweb/data/himawari/img/fd_/fd__b13_1330.jpg"},"subject_digest":{"algorithm":"sha256","value":"715ae4e488678de7ce1c6ed6710732f9dfbba5e33b7a24d36b81db993a1bb586"}},"verification":{"allowed_origin":"https://proof.excyberlab.net","rp_id":"proof.excyberlab.net"},"webauthn":{"authenticator_data":"EdbWTYuPw9QtSzE8jiIhpUMlLFo5aci40eUtlheY1ssdAAAAAA","client_data_json":"eyJ0eXBlIjoid2ViYXV0aG4uZ2V0IiwiY2hhbGxlbmdlIjoiNWlvbVdtTFk4OHhRYjFHd2lTUnNmME0xZzl2WlYwZVl3Yl96M3pLTzh2RSIsIm9yaWdpbiI6Imh0dHBzOi8vcHJvb2YuZXhjeWJlcmxhYi5uZXQiLCJjcm9zc09yaWdpbiI6ZmFsc2V9","signature":"MEUCIQCCLtCVI7JJaCDrPIAjUMp39bcq-sYiu40B2IygyT_FrAIgOKBQH9hgmdIw3mg3TSxf_ccC1tnWxm1mjkxiy4j_owI"}}
