{"identity":{"credential_event_digest":"sha256:ad07cc78a897ad959977e5a8d852a7f0855e6c9e360442b76434531cb1ae8ca8","identity_genesis_digest":"sha256:ad07cc78a897ad959977e5a8d852a7f0855e6c9e360442b76434531cb1ae8ca8","identity_state_digest":"sha256:f51e6809d8f52fd5f7914a405c740a140dfa72822d0f26b0b43efca510d455dc","orcid":"https://orcid.org/0000-0003-3001-7690"},"schema":"urn:skyseal:webauthn-bundle:v1","seal_payload":{"commitment_format":"skyseal-sha256-set-v1","created_at":"2026-09-18T03:01:25Z","identity_id":"https://orcid.org/0000-0003-3001-7690","identity_state_digest":"sha256:f51e6809d8f52fd5f7914a405c740a140dfa72822d0f26b0b43efca510d455dc","identity_version":1,"nonce":"Hhe8ieo1t873Uw0ZKeQ5HYqEM1ZQZoDohQ7MsRVNpLs","private_ledger_commitment":"sha256:6943055c8ef9daa6dfd41ec5c0e0a02371d857ec74a87d6aa6ea9075842f6e2c","schema":"urn:skyseal:seal-payload:v1","seal_id":"01a0b262-f811-7157-9ad3-eaa4509780f6","sky_witness":{"attribution":"Japan Meteorological Agency (JMA)","image_digest":"sha256:1a29022ee29fb4c82558e983dbd57ea5436e83dd8a1774925fadf3320913595d","media_type":"image/jpeg","observation_time":"2026-09-18T02:20:00Z","platform":"Himawari-8/9","product":"Full Disk Band 13 infrared","provider":"Japan Meteorological Agency (JMA)","retrieved_at":"2026-09-18T02:40:14Z","schema":"urn:skyseal:sky-witness:v1","source_url":"https://www.data.jma.go.jp/mscweb/data/himawari/img/fd_/fd__b13_0220.jpg"},"subject_digest":{"algorithm":"sha256","value":"941acb3873d8d71973b03fad1a3d9128832311e89bcfa9fec1a9e759388c5296"}},"verification":{"allowed_origin":"https://proof.excyberlab.net","rp_id":"proof.excyberlab.net"},"webauthn":{"authenticator_data":"EdbWTYuPw9QtSzE8jiIhpUMlLFo5aci40eUtlheY1ssdAAAAAA","client_data_json":"eyJ0eXBlIjoid2ViYXV0aG4uZ2V0IiwiY2hhbGxlbmdlIjoiUXlyeU5HWTVvWnZuR0Z6d0xWbGh4a3ZuX3ZVdVlBNzRac0ItOW1jaFRyayIsIm9yaWdpbiI6Imh0dHBzOi8vcHJvb2YuZXhjeWJlcmxhYi5uZXQiLCJjcm9zc09yaWdpbiI6ZmFsc2V9","signature":"MEQCIAZsp3agitk51bLWd6VuNrn_UY3-lKk0_yzHAmZCKM3DAiAHNhT_AmXaqCow0jhYygGVskRPTpVnRLmucDhrG565sg"}}
