{"identity":{"credential_event_digest":"sha256:ad07cc78a897ad959977e5a8d852a7f0855e6c9e360442b76434531cb1ae8ca8","identity_genesis_digest":"sha256:ad07cc78a897ad959977e5a8d852a7f0855e6c9e360442b76434531cb1ae8ca8","identity_state_digest":"sha256:f51e6809d8f52fd5f7914a405c740a140dfa72822d0f26b0b43efca510d455dc","orcid":"https://orcid.org/0000-0003-3001-7690"},"schema":"urn:skyseal:webauthn-bundle:v1","seal_payload":{"commitment_format":"skyseal-sha256-set-v1","created_at":"2026-09-01T15:29:02Z","identity_id":"https://orcid.org/0000-0003-3001-7690","identity_state_digest":"sha256:f51e6809d8f52fd5f7914a405c740a140dfa72822d0f26b0b43efca510d455dc","identity_version":1,"nonce":"abRF8pXdh4lB2_z8sNqrQTk6u34ePNd2zj4VfJUtDMg","private_ledger_commitment":"sha256:2be3f54c6addd8377ef4950f6c8c9c3ec8d5f79e3649c71501450dc3adc6d432","schema":"urn:skyseal:seal-payload:v1","seal_id":"01a05d95-b1d4-77f6-a073-2d0a6df65817","sky_witness":{"attribution":"Japan Meteorological Agency (JMA)","image_digest":"sha256:8ddf8608cf50466deadd6029699e69d7ecff315f37d78f29e45e2b0587c6a655","media_type":"image/jpeg","observation_time":"2026-09-01T15:00:00Z","platform":"Himawari-8/9","product":"Full Disk Band 13 infrared","provider":"Japan Meteorological Agency (JMA)","retrieved_at":"2026-09-01T15:28:06Z","schema":"urn:skyseal:sky-witness:v1","source_url":"https://www.data.jma.go.jp/mscweb/data/himawari/img/fd_/fd__b13_1500.jpg"},"subject_digest":{"algorithm":"sha256","value":"c287431a4e2b668807667d46edbcfc1eacfc6463815eeba415df069060d67e64"}},"verification":{"allowed_origin":"https://proof.excyberlab.net","rp_id":"proof.excyberlab.net"},"webauthn":{"authenticator_data":"EdbWTYuPw9QtSzE8jiIhpUMlLFo5aci40eUtlheY1ssdAAAAAA","client_data_json":"eyJ0eXBlIjoid2ViYXV0aG4uZ2V0IiwiY2hhbGxlbmdlIjoiT0JrXy1HTm14bnM1Y3FwMFlyaFNrMUxvR3NraTJZN2R2b3ZtRGZ5TFQxUSIsIm9yaWdpbiI6Imh0dHBzOi8vcHJvb2YuZXhjeWJlcmxhYi5uZXQiLCJjcm9zc09yaWdpbiI6ZmFsc2V9","signature":"MEYCIQCtNg0Xt4rcvhffjvCxUZZeLZ6WVHnxUNTA-p1Pw1J9gAIhALS790n53RIaQTtPJPnCWWSGE2w7vLqerkYGxlnXMiiS"}}
