{"identity":{"credential_event_digest":"sha256:ad07cc78a897ad959977e5a8d852a7f0855e6c9e360442b76434531cb1ae8ca8","identity_genesis_digest":"sha256:ad07cc78a897ad959977e5a8d852a7f0855e6c9e360442b76434531cb1ae8ca8","identity_state_digest":"sha256:f51e6809d8f52fd5f7914a405c740a140dfa72822d0f26b0b43efca510d455dc","orcid":"https://orcid.org/0000-0003-3001-7690"},"schema":"urn:skyseal:webauthn-bundle:v1","seal_payload":{"commitment_format":"skyseal-sha256-set-v1","created_at":"2026-09-13T12:24:06Z","identity_id":"https://orcid.org/0000-0003-3001-7690","identity_state_digest":"sha256:f51e6809d8f52fd5f7914a405c740a140dfa72822d0f26b0b43efca510d455dc","identity_version":1,"nonce":"Ar1GePhYYvl1Nt94QqlzgrKTepAB4sasReHttnyUsi8","private_ledger_commitment":"sha256:46182c60a64bdda4bd1fc0248b3baeecd4860002288d8627823c42146fbea7df","schema":"urn:skyseal:seal-payload:v1","seal_id":"01a09a96-502c-7836-9141-1217ed812ee1","sky_witness":{"attribution":"Japan Meteorological Agency (JMA)","image_digest":"sha256:9477481675967d018af715badaf827e3bd2c1819b1d73fb674f9d0c883b0c11c","media_type":"image/jpeg","observation_time":"2026-09-13T11:20:00Z","platform":"Himawari-8/9","product":"Full Disk Band 13 infrared","provider":"Japan Meteorological Agency (JMA)","retrieved_at":"2026-09-13T11:45:35Z","schema":"urn:skyseal:sky-witness:v1","source_url":"https://www.data.jma.go.jp/mscweb/data/himawari/img/fd_/fd__b13_1120.jpg"},"subject_digest":{"algorithm":"sha256","value":"42996886ae18b05593399be8e17b93f8df6c0be447221dd885cda154b3f72be4"}},"verification":{"allowed_origin":"https://proof.excyberlab.net","rp_id":"proof.excyberlab.net"},"webauthn":{"authenticator_data":"EdbWTYuPw9QtSzE8jiIhpUMlLFo5aci40eUtlheY1ssdAAAAAA","client_data_json":"eyJ0eXBlIjoid2ViYXV0aG4uZ2V0IiwiY2hhbGxlbmdlIjoiWDI5cjIxRFlqMHd0TGZmT1ZwX0RodzE4d1RzcWx1QVBNU1BTR0VXYnQyTSIsIm9yaWdpbiI6Imh0dHBzOi8vcHJvb2YuZXhjeWJlcmxhYi5uZXQiLCJjcm9zc09yaWdpbiI6ZmFsc2V9","signature":"MEUCIQDNufJ9IkklfQy9x8rBuIDfdpi3HJ92FVIsUZzgfN0NOwIgBpqg3E_VYyEYZRZ498Sy8C_NXEAyVQkc8kMyubA-E2g"}}
