{"identity":{"credential_event_digest":"sha256:ad07cc78a897ad959977e5a8d852a7f0855e6c9e360442b76434531cb1ae8ca8","identity_genesis_digest":"sha256:ad07cc78a897ad959977e5a8d852a7f0855e6c9e360442b76434531cb1ae8ca8","identity_state_digest":"sha256:f51e6809d8f52fd5f7914a405c740a140dfa72822d0f26b0b43efca510d455dc","orcid":"https://orcid.org/0000-0003-3001-7690"},"schema":"urn:skyseal:webauthn-bundle:v1","seal_payload":{"commitment_format":"skyseal-sha256-set-v1","created_at":"2026-09-09T01:06:56Z","identity_id":"https://orcid.org/0000-0003-3001-7690","identity_state_digest":"sha256:f51e6809d8f52fd5f7914a405c740a140dfa72822d0f26b0b43efca510d455dc","identity_version":1,"nonce":"SspQUJdmd2aGCMuWC-gCZB3BnXlHPjpU1n1yj7rZUYc","private_ledger_commitment":"sha256:c41d7907ddc9a9fdf6b6932b9c17adb348b03507e864a08c577f832c4410564f","schema":"urn:skyseal:seal-payload:v1","seal_id":"01a083a9-8745-70ea-a50e-626aeccfc634","sky_witness":{"attribution":"Japan Meteorological Agency (JMA)","image_digest":"sha256:c2221f5e488d2d4c883a9fe30a72b86cd4eef6121de8be39e3df154027da6284","media_type":"image/jpeg","observation_time":"2026-09-09T00:30:00Z","platform":"Himawari-8/9","product":"Full Disk Band 13 infrared","provider":"Japan Meteorological Agency (JMA)","retrieved_at":"2026-09-09T00:54:56Z","schema":"urn:skyseal:sky-witness:v1","source_url":"https://www.data.jma.go.jp/mscweb/data/himawari/img/fd_/fd__b13_0030.jpg"},"subject_digest":{"algorithm":"sha256","value":"088ebaa2c400aec97079e316f8470d6987cf10dda573e0015b54056e0d7430cc"}},"verification":{"allowed_origin":"https://proof.excyberlab.net","rp_id":"proof.excyberlab.net"},"webauthn":{"authenticator_data":"EdbWTYuPw9QtSzE8jiIhpUMlLFo5aci40eUtlheY1ssdAAAAAA","client_data_json":"eyJ0eXBlIjoid2ViYXV0aG4uZ2V0IiwiY2hhbGxlbmdlIjoiWnJGdEY0VXZhbmF2aEJRQUhBTVJHZ1NvTGhuM0xHOS1xcnNESVVwSmRKdyIsIm9yaWdpbiI6Imh0dHBzOi8vcHJvb2YuZXhjeWJlcmxhYi5uZXQiLCJjcm9zc09yaWdpbiI6ZmFsc2V9","signature":"MEUCIF-a0cININY4D7qz0muZN1AffF9sRHG2ZGQv5ScuvKiWAiEAi5URUG0IqwpbwKNgQVDxYD6q0Fafhd6R9N_x6uBSJLM"}}
