{"identity":{"credential_event_digest":"sha256:ad07cc78a897ad959977e5a8d852a7f0855e6c9e360442b76434531cb1ae8ca8","identity_genesis_digest":"sha256:ad07cc78a897ad959977e5a8d852a7f0855e6c9e360442b76434531cb1ae8ca8","identity_state_digest":"sha256:f51e6809d8f52fd5f7914a405c740a140dfa72822d0f26b0b43efca510d455dc","orcid":"https://orcid.org/0000-0003-3001-7690"},"schema":"urn:skyseal:webauthn-bundle:v1","seal_payload":{"commitment_format":"skyseal-sha256-set-v1","created_at":"2026-09-24T13:14:34Z","identity_id":"https://orcid.org/0000-0003-3001-7690","identity_state_digest":"sha256:f51e6809d8f52fd5f7914a405c740a140dfa72822d0f26b0b43efca510d455dc","identity_version":1,"nonce":"uUQxLYGB1ZXgpTSSAmdVtHz6qLR1n3lU7MKRKkxyBSY","private_ledger_commitment":"sha256:6da082b42bdddb749e56c7cd52ccd416a2b1e428cbba328ebbac08af7129caf8","schema":"urn:skyseal:seal-payload:v1","seal_id":"01a0d37f-11b0-7fe7-a991-e2af75f40098","sky_witness":{"attribution":"Japan Meteorological Agency (JMA)","image_digest":"sha256:1d91728b3edf831ca235d6d60aa9c5de2542a6fe4935ca28252af861b8895dc7","media_type":"image/jpeg","observation_time":"2026-09-24T12:30:00Z","platform":"Himawari-8/9","product":"Full Disk Band 13 infrared","provider":"Japan Meteorological Agency (JMA)","retrieved_at":"2026-09-24T12:56:58Z","schema":"urn:skyseal:sky-witness:v1","source_url":"https://www.data.jma.go.jp/mscweb/data/himawari/img/fd_/fd__b13_1230.jpg"},"subject_digest":{"algorithm":"sha256","value":"4895dfdc8a85ad5f20f4b1a86cabd6fb8bc272d1badc90353fdd629d2b23adcd"}},"verification":{"allowed_origin":"https://proof.excyberlab.net","rp_id":"proof.excyberlab.net"},"webauthn":{"authenticator_data":"EdbWTYuPw9QtSzE8jiIhpUMlLFo5aci40eUtlheY1ssdAAAAAA","client_data_json":"eyJ0eXBlIjoid2ViYXV0aG4uZ2V0IiwiY2hhbGxlbmdlIjoidGxCT0M5WGFrVnQzeHFkUkxNY05FSGI4VzR1SFJoY1VZSUJidTBhcFkxTSIsIm9yaWdpbiI6Imh0dHBzOi8vcHJvb2YuZXhjeWJlcmxhYi5uZXQiLCJjcm9zc09yaWdpbiI6ZmFsc2V9","signature":"MEUCIGII0IvFKvN7x-nUn-Kzbq1Jh-yY8wE3X5FvgdTvp4ZIAiEAtajYwVMYDkGiw9Z6SiCKbAc9gN-LOOAzqaMFVGkK98U"}}
