{"identity":{"credential_event_digest":"sha256:ad07cc78a897ad959977e5a8d852a7f0855e6c9e360442b76434531cb1ae8ca8","identity_genesis_digest":"sha256:ad07cc78a897ad959977e5a8d852a7f0855e6c9e360442b76434531cb1ae8ca8","identity_state_digest":"sha256:f51e6809d8f52fd5f7914a405c740a140dfa72822d0f26b0b43efca510d455dc","orcid":"https://orcid.org/0000-0003-3001-7690"},"schema":"urn:skyseal:webauthn-bundle:v1","seal_payload":{"commitment_format":"skyseal-sha256-set-v1","created_at":"2026-09-18T09:21:58Z","identity_id":"https://orcid.org/0000-0003-3001-7690","identity_state_digest":"sha256:f51e6809d8f52fd5f7914a405c740a140dfa72822d0f26b0b43efca510d455dc","identity_version":1,"nonce":"tHCcsHUMx14_Rpv5suAFX2K2Pdh9Nei_N9sJVnFrPyo","private_ledger_commitment":"sha256:e2e2f6e8d0cdb90a05d79027fe57eea4e44b0479925d15c05e89c2804dc74455","schema":"urn:skyseal:seal-payload:v1","seal_id":"01a0b3d2-02a9-7254-83a3-3d20590fe913","sky_witness":{"attribution":"Japan Meteorological Agency (JMA)","image_digest":"sha256:b46ff44d5d5eb3af3a21224c8a13a029b0ceb3ee452ba70dcc837a0435908bc1","media_type":"image/jpeg","observation_time":"2026-09-18T09:00:00Z","platform":"Himawari-8/9","product":"Full Disk Band 13 infrared","provider":"Japan Meteorological Agency (JMA)","retrieved_at":"2026-09-18T09:21:19Z","schema":"urn:skyseal:sky-witness:v1","source_url":"https://www.data.jma.go.jp/mscweb/data/himawari/img/fd_/fd__b13_0900.jpg"},"subject_digest":{"algorithm":"sha256","value":"8619dfd4288177760eb2a4df15d32624fa566108c11c7c795d94d9c691274a5f"}},"verification":{"allowed_origin":"https://proof.excyberlab.net","rp_id":"proof.excyberlab.net"},"webauthn":{"authenticator_data":"EdbWTYuPw9QtSzE8jiIhpUMlLFo5aci40eUtlheY1ssdAAAAAA","client_data_json":"eyJ0eXBlIjoid2ViYXV0aG4uZ2V0IiwiY2hhbGxlbmdlIjoiRTY2ckxIaGFMZ1ZBUmFxWTlXckNac2MwXzlKUGp5c3UwVkZWdW12Tko1SSIsIm9yaWdpbiI6Imh0dHBzOi8vcHJvb2YuZXhjeWJlcmxhYi5uZXQiLCJjcm9zc09yaWdpbiI6ZmFsc2V9","signature":"MEQCIDqZCxNRT44oqGWJnAvWvpYNjLdCZUPVUJev2EBsuAHLAiBXbjlriLem4FkxcfpzKGQhFgJ13LM_0VgasUgJGBdyww"}}
