{"identity":{"credential_event_digest":"sha256:ad07cc78a897ad959977e5a8d852a7f0855e6c9e360442b76434531cb1ae8ca8","identity_genesis_digest":"sha256:ad07cc78a897ad959977e5a8d852a7f0855e6c9e360442b76434531cb1ae8ca8","identity_state_digest":"sha256:f51e6809d8f52fd5f7914a405c740a140dfa72822d0f26b0b43efca510d455dc","orcid":"https://orcid.org/0000-0003-3001-7690"},"schema":"urn:skyseal:webauthn-bundle:v1","seal_payload":{"commitment_format":"skyseal-sha256-set-v1","created_at":"2026-10-31T07:51:52Z","identity_id":"https://orcid.org/0000-0003-3001-7690","identity_state_digest":"sha256:f51e6809d8f52fd5f7914a405c740a140dfa72822d0f26b0b43efca510d455dc","identity_version":1,"nonce":"2-bJ0EZCRBlTv5CuDOX5ez_MZZ3BTvWvSKdBRRgByoY","private_ledger_commitment":"sha256:693cfcd9dff4a7e2d5e4da432bd2cccfe67801973eab914340727afece1b4187","schema":"urn:skyseal:seal-payload:v1","seal_id":"01a190ed-57fa-7d52-a2b2-1c0fdf869e8b","sky_witness":{"attribution":"Japan Meteorological Agency (JMA)","image_digest":"sha256:808269007e53cf6d52b93293a9e68f8552136719329c038d58c51a39ecc82a52","media_type":"image/jpeg","observation_time":"2026-10-31T07:20:00Z","platform":"Himawari-8/9","product":"Full Disk Band 13 infrared","provider":"Japan Meteorological Agency (JMA)","retrieved_at":"2026-10-31T07:47:12Z","schema":"urn:skyseal:sky-witness:v1","source_url":"https://www.data.jma.go.jp/mscweb/data/himawari/img/fd_/fd__b13_0720.jpg"},"subject_digest":{"algorithm":"sha256","value":"0fddc87b679401d8ae072689309aa3792fb80f069f573e6ef29d1ab449c42dc9"}},"verification":{"allowed_origin":"https://proof.excyberlab.net","rp_id":"proof.excyberlab.net"},"webauthn":{"authenticator_data":"EdbWTYuPw9QtSzE8jiIhpUMlLFo5aci40eUtlheY1ssdAAAAAA","client_data_json":"eyJ0eXBlIjoid2ViYXV0aG4uZ2V0IiwiY2hhbGxlbmdlIjoiR245SU5fcko2RVRKZjhRUFVjVkhnYVBsWi1KOURIQW5NdE52VEtRQjFXOCIsIm9yaWdpbiI6Imh0dHBzOi8vcHJvb2YuZXhjeWJlcmxhYi5uZXQiLCJjcm9zc09yaWdpbiI6ZmFsc2V9","signature":"MEUCIE9hVB3T-lJ9LcCVBQZ3644KkpmNUoeh9Mk1ql6ox-J2AiEA0EkOmNj2r6NME9ZjaKBNUXjo3qKarluPkIuK5sn8AO0"}}
