{"identity":{"credential_event_digest":"sha256:ad07cc78a897ad959977e5a8d852a7f0855e6c9e360442b76434531cb1ae8ca8","identity_genesis_digest":"sha256:ad07cc78a897ad959977e5a8d852a7f0855e6c9e360442b76434531cb1ae8ca8","identity_state_digest":"sha256:f51e6809d8f52fd5f7914a405c740a140dfa72822d0f26b0b43efca510d455dc","orcid":"https://orcid.org/0000-0003-3001-7690"},"schema":"urn:skyseal:webauthn-bundle:v1","seal_payload":{"commitment_format":"skyseal-sha256-set-v1","created_at":"2026-09-12T06:20:48Z","identity_id":"https://orcid.org/0000-0003-3001-7690","identity_state_digest":"sha256:f51e6809d8f52fd5f7914a405c740a140dfa72822d0f26b0b43efca510d455dc","identity_version":1,"nonce":"8tfgQUB7h2YDotzQTj9R64XuZ5xRR0QqnH0q0givuyY","private_ledger_commitment":"sha256:8543314d0e80cc5002ca5988748e18d0ac42026556070e56cea860bbb483bfa7","schema":"urn:skyseal:seal-payload:v1","seal_id":"01a090c1-94c7-7fb6-baf9-9a4a28117d16","sky_witness":{"attribution":"Japan Meteorological Agency (JMA)","image_digest":"sha256:0e32e92124c0e0347a27e0a01f56a58da13d78b0e7837884e6ebf70702a21383","media_type":"image/jpeg","observation_time":"2026-09-11T13:30:00Z","platform":"Himawari-8/9","product":"Full Disk Band 13 infrared","provider":"Japan Meteorological Agency (JMA)","retrieved_at":"2026-09-11T13:56:40Z","schema":"urn:skyseal:sky-witness:v1","source_url":"https://www.data.jma.go.jp/mscweb/data/himawari/img/fd_/fd__b13_1330.jpg"},"subject_digest":{"algorithm":"sha256","value":"cb39946d3e35f2fad66232bf191716477b3d40ccd6e31ed6b060dccff38345bb"}},"verification":{"allowed_origin":"https://proof.excyberlab.net","rp_id":"proof.excyberlab.net"},"webauthn":{"authenticator_data":"EdbWTYuPw9QtSzE8jiIhpUMlLFo5aci40eUtlheY1ssdAAAAAA","client_data_json":"eyJ0eXBlIjoid2ViYXV0aG4uZ2V0IiwiY2hhbGxlbmdlIjoiaXl1QXY4V2VsWTN0TGhGeEtxSUpCeXgxX1VRYmR1dVAzNDc5OXhHcTJSSSIsIm9yaWdpbiI6Imh0dHBzOi8vcHJvb2YuZXhjeWJlcmxhYi5uZXQiLCJjcm9zc09yaWdpbiI6ZmFsc2V9","signature":"MEYCIQDG9ayYvIzycSIubkdAq5XrZfBGpv3LG-F_7j51qAyAWAIhAO1t5IGtJsq10XmkpaYr-0EF4I1y7Yc9rk8VGlDz48Zz"}}
