{"identity":{"credential_event_digest":"sha256:ad07cc78a897ad959977e5a8d852a7f0855e6c9e360442b76434531cb1ae8ca8","identity_genesis_digest":"sha256:ad07cc78a897ad959977e5a8d852a7f0855e6c9e360442b76434531cb1ae8ca8","identity_state_digest":"sha256:f51e6809d8f52fd5f7914a405c740a140dfa72822d0f26b0b43efca510d455dc","orcid":"https://orcid.org/0000-0003-3001-7690"},"schema":"urn:skyseal:webauthn-bundle:v1","seal_payload":{"commitment_format":"skyseal-sha256-set-v1","created_at":"2026-09-30T14:08:16Z","identity_id":"https://orcid.org/0000-0003-3001-7690","identity_state_digest":"sha256:f51e6809d8f52fd5f7914a405c740a140dfa72822d0f26b0b43efca510d455dc","identity_version":1,"nonce":"xbFI6QULYG90DmAxK5HSp2UwOj9FzBnlR3tEt2NHChI","private_ledger_commitment":"sha256:1f7f5e548c9518e8e4e6601d5522e13ed19ce1ec1b1213806597d66281a906e3","schema":"urn:skyseal:seal-payload:v1","seal_id":"01a0f2a4-cc0c-7a25-bcd8-62606d48f8d2","sky_witness":{"attribution":"Japan Meteorological Agency (JMA)","image_digest":"sha256:f0cf7861a3852edc695bc8da1fdbe31aa91d3e08ebbba0624221f0a876f7b972","media_type":"image/jpeg","observation_time":"2026-09-30T13:40:00Z","platform":"Himawari-8/9","product":"Full Disk Band 13 infrared","provider":"Japan Meteorological Agency (JMA)","retrieved_at":"2026-09-30T14:08:01Z","schema":"urn:skyseal:sky-witness:v1","source_url":"https://www.data.jma.go.jp/mscweb/data/himawari/img/fd_/fd__b13_1340.jpg"},"subject_digest":{"algorithm":"sha256","value":"44c2fed5b93b632f6af2695c13c16ea802b5028ca66638dbeb2162fe0c9b7656"}},"verification":{"allowed_origin":"https://proof.excyberlab.net","rp_id":"proof.excyberlab.net"},"webauthn":{"authenticator_data":"EdbWTYuPw9QtSzE8jiIhpUMlLFo5aci40eUtlheY1ssdAAAAAA","client_data_json":"eyJ0eXBlIjoid2ViYXV0aG4uZ2V0IiwiY2hhbGxlbmdlIjoibm13QW1iZ0E0cnozZkQyRXA4U1hiSHNKMG4zdnBKX08yNmh6QnZzdGRBOCIsIm9yaWdpbiI6Imh0dHBzOi8vcHJvb2YuZXhjeWJlcmxhYi5uZXQiLCJjcm9zc09yaWdpbiI6ZmFsc2V9","signature":"MEYCIQCVqnmEW6QO3l0-KxRjXlNm8FWQ8fzV1g5VmGMEDACRFQIhALy_ZJpD9Oe79s414aWCvigRv7B1AFWhPp-YcgMzT-Om"}}
